ID,Tweet,Replies,Retweets,Likes,Bookmarks,Views,Username,PostDate,Timestamp,Category
1861378055186546951,เอาจริงๆ อันนี้ฟังชาวบ้านเขามาอีกที เขาว่าผู้สมัครอนาคตใหม่ในตอนนั้นบ้างคนก็แอบมีซื้อเสียงเหมือนกัน เพราะตอนนั้นเราก็รู้ๆกันว่ายังไม่ได้กรองคนแบบเข้มข้นเหมือนตอนมาเป็นก้าวไกล,0,0,2,0,189,inwmrm,2024-11-26 11:54:45,2024-11-28 20:41:26,อนาคตใหม่
1860870386902286379,"[First Meet: สมาชิกพรรคเครือข่ายเพื่อความเสมอภาคทางเพศ พรรคประชาชน]

กิจกรรม First Meet ของเครือข่ายเพื่อความเสมอภาคทางเพศ  จัดขึ้นเมื่อวันเสาร์ที่ 23 พฤศจิกายน 2567 ณ ห้องประชุมชั้น 7 อาคารอนาคตใหม่ พรรคประชาชน",1,13,20,0,585,kru_tun,2024-11-25 02:17:28,2024-11-28 20:41:26,อนาคตใหม่
1861811037428916577,เมื่อกี้ล็อคแอค ล่าสุดนางปิดแอคเลยจ้าาา เก่งนักไม่ใช่หรอ รู้ดีทุกอย่าง แต่ไม่รู้อยู่อย่างเดียว คืออนาคตตัวเองว่า จะเป็นยังไง (รอดูต่อไปนะฮะว่า มันจะแอคใหม่มาเปิด),2,60,47,1,1815,Basbasbrother,2024-11-27 16:35:16,2024-11-28 20:41:26,อนาคตใหม่
1857415917694812162,"สปีชรับรางวัล Artist of The Year จากงาน Korea TikTok Awards 2024 ของคาริน่า

 

 ตั้งแต่เพลง Supernova, Armageddon ไปจนถึง Whiplash พวกเราได้รับความรักมายมากไม่เพียงแต่จากแฟน ๆ แต่รวมถึงผู้คนทั่วไปอีกด้วย ในอนาคตพวกเราก็จะแสดงเพลงแนวใหม่ เท่ ๆ",0,786,339,25,11996,BEMYKARINA_TH,2024-11-15 13:30:38,2024-11-28 20:41:26,อนาคตใหม่
1860247815517274175,การชนะรางวัลเพลงแห่งปีของเอสป้าส่งผลทั้งทางตรงและทางอ้อมต่อโลกในหลายมิติ โดยเน้นไปที่การสร้างแรงบันดาลใจและการพัฒนาเศรษฐกิจของโลก ในขณะเดียวกันก็ต้องมีการจัดการด้านสิ่งแวดล้อมผนวกกับการสรรสร้างนวัตกรรมเทคโนโลยีใหม่ๆเพื่อให้เกิดความยั่งยืนในอนาคตให้กับสังคมโลกยุคใหม่,2,390,62,6,7854,nongkungroast,2024-11-23 09:03:35,2024-11-28 20:41:26,อนาคตใหม่
1774028811262206199,"ในรอบ 20 ปี การเมืองบ้านใหญ่เสื่อมลง เพราะการเมืองเชิงนโยบาย 

รับชม ""PrachaTalk EP. 25 : คนรุ่นใหม่ บ้านใหญ่ อนาคตพรรคการเมืองไทย"" : https://youtu.be/qx6vvfdTpdo?t=3680…

#เลือกตั้ง #เลือกตั้งท้องถิ่น #บ้านใหญ่ #การเมือง #prachatalk #ประชาทอล์ก",0,6,12,0,2255,prachatai,2024-03-30 11:00:03,2024-11-28 20:41:26,อนาคตใหม่
1860830727639875995,ทำงานตามปกตินั่นแหละ เพราะปกติที่เห็นมาตลอดตั้งแต่เป็นพรรคอนาคตใหม่ พรรคก้าวไกล จนมาเป็นพรรคประชาชนอยู่ในเวลานี้ก็ถือว่าเป็นพรรคการเมืองที่ทำงานหนักเพื่อประชาชนได้ประมาณหนึ่งอยู่แล้ว แถมทำงานหนักกว่าพวกฝักถั่วหัวฝ่อที่ไม่เน้นงานแต่เน้นโกยต้นทุนคืนกับรอลอกงานเพื่อนไปทำเป็นไหนๆ,0,9,18,0,277,thetukk12,2024-11-24 23:39:52,2024-11-28 20:41:26,อนาคตใหม่
1860680789027111303,"จริงที่สุด
เพราะพรรคอนาคตใหม่ถูกยุบ คณะก้าวหน้าถือกำเนิดขึ้นและประกาศจะเดินหน้าทำงานการเมืองท้องถิ่น
เท่านั้นแหละ
หูผึ่ง ตื่นตัวกันทั้งประเทศ",0,0,4,0,386,Moccafrappe1,2024-11-24 13:44:04,2024-11-28 20:41:26,อนาคตใหม่
1857260188698636638,"เมื่อคืนผมบอกให้ธนาธรออกมาชี้แจงอย่างโปร่งใสว่าเคยไปคุยอะไรกับทักษิณมาบ้าง จะได้หมดข้อครหา 

ก็มีกองเชียร์ส้มที่โลกมีแต่ขาวกับดำสงสัยในตัวผม

ผมอยากจะบอกว่าผมเป็นสมาชิกรุ่นแรกๆของพรรคส้มมาตั้งแต่พรรคอนาคตใหม่ครับ ผมทำกิจกรรมกับพรรคมามากกว่าพวกคุณเยอะ",79,198,641,32,96012,SleeplessBKKNew,2024-11-15 03:11:49,2024-11-28 20:41:26,อนาคตใหม่
1860308072364920890,ตั้งแต่อ่านมาเนี่ยอยากได้โอกาสให้กับเด็กจบใหม่กันมาก แต่ถามหน่อยมีใครเห็นใจเด็กที่มันเอาอนาคตตัวเองมาวางตรงนี้กันสักคนยัง https://x.com/suthinaja/stat/suthinaja/status/1860299551456010725…,0,10,4,0,531,2thekimlee,2024-11-23 13:03:01,2024-11-28 20:41:26,อนาคตใหม่
1861079708802375925,"ได้เวลาส่งพวกเขากลับสู่โลกนิยายกันแล้วละ 
ขอให้ทุกคนโชคดีและเส้นทางชีวิตทุกตัวละครนี้เติบโตไปอย่างสวยงาม ส่วนในชีวิตจริงพวกเราจะกลับมาพบกันใหม่ในอนาคต ขอบคุณที่ทั้งทีมงานและตัวนักแสดงที่รังสรรค์ซีรีส์เรื่องนี้มา

#JACKANDJOKERFINALEP
FINAL EP U STEAL MY HEART",0,14,14,1,213,tawann_anww,2024-11-25 16:09:14,2024-11-28 20:41:26,อนาคตใหม่
1857285118932750816,"สมาชิกวง THE BOYZ ทุกคน เตรียมเริ่มต้นเส้นทางใหม่ไปพร้อมกับค่าย ONE HUNDRED หลังสิ้นสุดสัญญา 7 ปี กับต้นสังกัดเดิม IST Entertainment 

แฟน ๆ มาร่วมเป็นกำลังใจให้กับ THE BOYZ สำหรับการเริ่มต้นกิจกรรมในต้นสังกัดใหม่ และตั้งตารอผลงานในอนาคตของหนุ่ม ๆ ไปด้วยกันนะคะ

อ่านเพิ่มเติม >",0,1661,314,26,65782,Korseries,2024-11-15 04:50:53,2024-11-28 20:41:26,อนาคตใหม่
1857438349105283455,เป็นช่วงเวลาที่มีความสุขมากๆในชีชีวิตชั้นเลย ขอให้เดกๆ ทุกคนโชคดี เดินต่อไปในเส้นทางของตัวเองอย่างราบรื่น ขอให้ได้ลองมีความรักแบบคนทั่วไป ได้ใช้ชีวิตทุกแบบที่อยากใช้ อย่าบาดเจ็บนะ อย่ากดดันตัวเอง ถ้าในอนาคตได้กลับมาเจอกันใหม่ ขอให้ชั้นตกหลุมรักแกอีกครั้งแบบไม่รส.เจบอีกแล้ว ,0,314,142,10,9905,ginalovejeg,2024-11-15 14:59:46,2024-11-28 20:41:26,อนาคตใหม่
1861438409132384543,"อ.ป๊อกนี่เสียคนแล้ว ทุกวันนี้พรรคด้อมนี่แหละไม่เหลืออัตลักษณ์แบบอนาคตใหม่แล้ว พรรคด้อมคือปชป 2แบบที่คุณอภิสิทธิเคยบอก จุดยืนหายไปหมด เด๋วจะwoke เด๋วจะคนเท่ากัน กลายเป็นพรรคเปโด SH พรรคนิยมเทคโนแครต พรรคดีแต่เถียง ไม่เคยค้านแบบคนก้าวหน้า จับจดทำแต่คอนเท้นท์

จากใจคนเคยเลือก..",29,142,217,17,19852,kookaburra555,2024-11-26 15:54:35,2024-11-28 20:41:26,อนาคตใหม่
1860300896955171164,ความจริงคือไม่มีใครให้เด็กจบใหม่มาฝึกงานในตำแหน่ง senior supervisor CEO ใดๆที่มีผลต่ออนาคตของเด็กนะคะ จะฝึกฝนเก็บปสก.ใดๆก็ลองทำในวงในค่ายดูก่อนเนอะ อยู่ๆมาเป็น director รายการทั้งๆที่ประสบการณ์ 0 อันนี้เหมือนเด็กเส้นรึป่าว? แล้วสมควรมาฝึกงานในรายการที่เกี่ยวกับอนาคตเด็กหรอคะ?,0,16,8,0,674,ppinnto_,2024-11-23 12:34:31,2024-11-28 20:41:26,อนาคตใหม่
1859859911192216018,"⠀
⠀⠀⠀⠀ในอนาคต ถ้าไม่มีอาร์ตใหม่ ๆ ของฉันแล้วก็ไม่เป็นไร . . เพราะอะไรน่ะเหรอ ?

⠀⠀⠀⠀# ฝันเป็นจริง # ฝันให้ไกลไปให้ถึง # ไอดอล # ก็อตซิลล่า
⠀⠀⠀⠀",2,54,65,1,1370,iwaizumace04,2024-11-22 07:22:12,2024-11-28 20:41:26,อนาคตใหม่
1861052619588030583,"ในการเลือกตั้งอบจล่าสุดเพื่อไทยนำห่างส้มมากขึ้น ดูยังไงส้มก็ไม่ควรดีใจนะ  

ยิ่งบอกว่าพทไม่มีผลงาน แถมส้มขนคนมาปราศัยจัดเต็ม 2 รอบ ทั้งรุ่นอนาคตใหม่ ก้าวไกล และปชช เพื่อไทยยังทิ้งห่างคุณไปอีก อาการหนักแล้วส้มส้ม",0,0,6,0,240,ShibaLavayou,2024-11-25 14:21:35,2024-11-28 20:41:26,อนาคตใหม่
1861667060402790742,"ขอฝากเอ็นดูคู่ อุ๋งๆๆ  JM 
ไว้ในอ้อนอกอ้อมใจของทุกคนด้วยนะคะน่ารักกันมากๆเลย 
ทั้ง 2 คน  เป็นซัพพอร์ตโรล(คู่รอง) เรื่อง คุณวาฬร้านชำ Whale Store xoxo โปรเจคซีรี่ย์ 2025  ฝากเอ็นดูทั้งสองคนด้วยนะคะ  
อนาคตคู่หลักใหม่ เจ้มทีวี2026  มีแฮทแท็กคู่ #.จูนมิวนิค",0,16,30,1,1236,film_fmphoto,2024-11-27 07:03:09,2024-11-28 20:41:26,อนาคตใหม่
1861832793535422694,"เมื่อพี่มายอยากรู้ว่าตัวเองเป็นอะไรบ้าง มีกี่ร่าง ในอนาคตอันใกล้หนูเชื่อว่าพี่มายต้องมีร่างใหม่อีกแน่นอน!!5555555

MILE GQ ENTERTAINER OF THE YEAR

#GQMOTY2024xMILEJES
@milephakphum
 #MilePhakphum",0,15,10,0,520,i_DAW_,2024-11-27 18:01:43,2024-11-28 20:41:26,อนาคตใหม่
1857232569076728247,"เพราะเราเชื่อว่าคุณภาพชีวิตแบบโลกที่หนึ่ง เกิดได้ทุกที่ในเมืองไทย ถ้ามีท้องถิ่นที่มีประสิทธิภาพ

18 พฤศจิกายนนี้ เวลา 10.30 น. ณ อาคารอนาคตใหม่ เชิญชวนทุกท่านร่วมติดตามการเปิดตัวผู้สมัครนายก อบจ. พรรคประชาชน พร้อมชุดนโยบาย 5 ด้าน",53,1298,2415,12,42118,PPLEThai,2024-11-15 01:22:04,2024-11-28 20:41:26,อนาคตใหม่
1860685554284683693,"‘วิกฤติเด็กไทย’ ปัญหาอนาคตชาติ พัฒนาการภาษาช้า-สุขภาพจิตน่าห่วง อัตราเกิดใหม่น้อย อาจทำ GDP โตไม่ถึง 2%

5 ทศวรรษที่ผ่านมา ระดับเจริญพันธุ์ หรือการเกิดลดลงอย่างรวดเร็ว โดยอัตราเจริญพันธุ์รวม (Total Fertility Rate :TFR) หรือจำนวนบุตรโดยเฉลี่ยที่ผู้หญิง 1 คนจะมีตลอดวัยเจริญพันธุ์",1,39,29,2,4998,ktnewsonline,2024-11-24 14:03:00,2024-11-28 20:41:26,อนาคตใหม่
1861653063087636873,ทุกวันนี้เด็กเดใหม่กันเยอะ วงเกิดใหม่ตลอด แต่อาชีพไอดอลมันไม่มั่นคงเลย การจะเป็นวงที่ประสบความสำเร็จได้ ค่ายคือปัจจัยสำคัญมากๆ ต่อให้มีความสามารถแค่ไหน แต่ไปอยู่ค่ายที่ดองเก่ง ไม่ได้มองอนาคตแบบเดียวกัน สุดท้ายก็อาจจะรู้สึกเสียดายเปล่าๆ,0,38,26,2,1950,bamFF66798867,2024-11-27 06:07:32,2024-11-28 20:41:26,อนาคตใหม่
1860664809244459232,"ผลจะเป็นอย่างไรก็จะไม่โทษใครค่ะ ทุกคนเต็มที่+ตื่นตัวกับการเลือกตั้งครั้งนี้มากๆ สู้กันสุดใจ 

ครั้งนี้มีแค่ชนะกับพัฒนา เราเดินกันมาไกลมากๆ แล้วตั้งแต่อนาคตใหม่ ถ้าถึงเส้นชัยก็พร้อมจะฉลอง แต่ถ้ายังก็เดินต่อค่ะ

#เลือกตั้งนายกอบจอุดรธานี 
#เลือกตั้งนายกอบจ 
#เลือกตั้งนายกอบจอุดร",1,10,9,0,2740,summer6475288,2024-11-24 12:40:34,2024-11-28 20:41:26,อนาคตใหม่
1859487750787039361,"นี่สินะความแมส พรรคที่เกิดขึ้นในช่วงหลังๆ ที่เป็นข่าว ในชื่อมักจะมีคำว่า ก้าว, ใหม่, อนาคต
ส่วนสัญลักษณ์ CI ต่างๆ จะมีความเป็นสามเหลี่ยมไม่ก็ใช้สีส้ม",15,819,384,7,58223,UUUPPP11,2024-11-21 06:43:22,2024-11-28 20:41:26,อนาคตใหม่
1861747930392301814,"ผมก็ไม่ให้ค่าข้อมูลเท็จของคุณเช่นกันครับ 
.
ชื่อหลักสูตรนี้คือ
.
หลักสูตรการป้องกันราชอาณาจักร สำหรับ #ผู้บริหารแห่งอนาคต (วปอ.บอ.) รุ่นที่๑
.
วปอ. #ต้องการแนวร่วมจาก ผู้บริหารในอนาคต เจนใหม่  ต้องการส่งเสริมให้มีความรู้ด้านการเมืองความมั่นคง
.
สมัคร 500 สัมภาษณ์เหลือ 200 โปร่งใส",1,1,2,0,557,boling55556,2024-11-27 12:24:30,2024-11-28 20:41:26,อนาคตใหม่
1861438721196949835,อนาคตใหม่ ไม่นึกเลยเลียนแบบsocial demที่ทำลายเมกา ยุโรปย่อยยับ เลือกพรรคคุณไม่ลงอ่ะ บอกเลย,1,1,17,0,634,kookaburra555,2024-11-26 15:55:49,2024-11-28 20:41:26,อนาคตใหม่
1859065007029563864,ตอนเป็นอนาคตใหม่ใครขออะไรทักษิณช่วยทำอะไรให้บ้าง  ให้ทักษิณช่วยเป็นตัวกลางเชื่อมให้ติดต่อกับใครอะไรยังไงบ้าง เรื่องสนุกๆทั้งนั้น,0,3,6,0,111,off_patara,2024-11-20 02:43:32,2024-11-28 20:41:26,อนาคตใหม่
1862070529932574952,"วิทาลิกปิดท้ายด้วยทอล์กแบบเท่ๆ ว่า
""The technology is ready. The time to build is now""

ถ้าคุณเชื่อว่าโลกเก่ากำลังถูก Disrupt ด้วยสิ่งใหม่
ETH จึงเป็นอนาคตที่ไม่ต้องใช้กาว
แต่ใช้ Real Use Case For Real World จริงๆ",1,0,2,0,126,0xthesleeper,2024-11-28 09:46:24,2024-11-28 20:41:26,อนาคตใหม่
1860298212856532995,ไม่เคยมีบ.ไหนเอาเด็กจบใหม่ไร้ประสบการณ์มาเป็นหน. เป็น ceo ที่มีผลต่ออนาคตคนในบ.นะ,0,75,11,1,1357,Fridaynight1001,2024-11-23 12:23:51,2024-11-28 20:41:26,อนาคตใหม่
1861253591169933429,"การทลายเศรษฐกิจและทุนผูกขาด
โดย : ธนาธร จึงรุ่งเรืองกิจ
อดีต หน.พรรคอนาคตใหม่
https://youtu.be/ocN9biXqDsM?si=9GEZ-3YUbNedAO-k…",1,1,10,1,607,Citizen2600,2024-11-26 03:40:11,2024-11-28 20:41:26,อนาคตใหม่
1859486065641631939,"“รัฐบาลจะมีการแถลงสิ่งที่ทำไปในรัฐบาลนี้ 90 วัน ในวันที่ 12 ธันวาคมนี้ รับรองจะมีเรื่องนโยบายดีๆ มาเล่าให้ฟังว่าจะเกิดอะไรขึ้นในอนาคตอีก และของขวัญปีใหม่ที่จะให้กับประชาชน”
.
แพทองธาร ชินวัตร นายกรัฐมนตรี
.
#แพทองธาร #สัมมนาประชาชาติ #ประชาชาติธุรกิจ  #PRACHACHATThailand202",1,0,5,0,1002,prachachat,2024-11-21 06:36:40,2024-11-28 20:41:26,อนาคตใหม่
1860730474777411864,"สุดยอดมากครับ เราเติบโตแข็งแกร่ง ขึ้นทุกวัน 
ขอบคุณผู้ช่วยหาเสียงของผม  
@Pita_MFP
 นายกของผม 
สู้ไปด้วยกัน ครับ  
อนาคตใหม่ ของ ก้าวไกล คือ ประชาชน ",0,3,25,0,1869,TKorn7knock,2024-11-24 17:01:30,2024-11-28 20:41:26,อนาคตใหม่
1858689003735888316,ป้าดแบบโอ้โห่ มาอย่างหงส์องค์ความรู้เหนือนายกรัฐมนตรี ตบเกรียนมังกือ ตอนเลือกอนาคตใหม่ ฉันก็ว่าผู้หญิงคนนี้ควรจะได้เป็นโฆษกรัฐบาล แต่พอรู้จักมากขึ้นๆ ทั้งความฉลาด ศักยภาพมันสมองที่เริ่ด ทัศนคติ วุฒิภาวะ ทำงานอย่างเอาจริงเอาจัง คุณช่อพรรณิการ์นี่ควรจะเป็นนายกหญิงเท่านั้นเลย,2,89,177,1,4573,loreneeliz,2024-11-19 01:49:25,2024-11-28 20:41:26,อนาคตใหม่
1859871830024262104,"การเมืองใหม่อนาคตดีกว่าเก่าแบบไหน ถึงต้องไปโฆษณาช่วยนายทุนจำหน่ายจักรยานอ่ะครับ

#อบจอุดรธานี ซุมสูอุดร สรุปพรรคนี้ที่ส่งมรดก คสช.ลงสมัคร มีนโยบายอะไรบ้างครับเนี่ยยย",15,17,83,1,19560,Thaksin_goto,2024-11-22 08:09:33,2024-11-28 20:41:26,อนาคตใหม่
1860490672400199693,คือถ้าไม่สบายใจจะคบต่อก็ไม่ต้องไปว่าอะไรเพื่อนหรอก ก็ตัดไปเลยแล้วหาเพื่อนใหม่ เผื่อในอนาคตยังอยากจะมีเขาในชีวิต อะไรก็เกิดขึ้นได้ เราแค่รู้สึกว่า คสพ. สำคัญมาก อยู่ที่การกำหนดหลังพูดคุยล้วนๆ ถ้าเขายังทำสิ่งที่เราไม่ชอบอีก ก็ค่อยตัดสินใจใหม่ก็ได้,0,0,2,0,228,Nikky_liu,2024-11-24 01:08:37,2024-11-28 23:00:28,อนาคตใหม่
1861737195192951219,"เฉลย 4 

ได้รับโอกาสใหม่ๆเข้ามาในชีวิต จะมีข่าวการเปลี่ยนงาน เปลี่ยนที่อยู่อาศัย พบเจอความสัมพันธ์ใหม่ ได้ไปสถานที่ใหม่ๆสร้างประสบการณ์ดีๆ การงานโดดเด่นมองเห็นเส้นทางที่ชัดเจนในอนาคต มีความเจริญก้าวหน้า",1,27,37,7,1174,MoondyTarot,2024-11-27 11:41:51,2024-11-28 23:00:28,อนาคตใหม่
1859948198229651567,"แต่พอเป็นก้าวไกล ศาล รธน.มองว่าคดีอิลลูมินาติ มีมูล (มีมติรับคำร้องไว้พิจารณา19 ก.ค. 2562)

แค่ ปชน. (อนค-กก.)อยู่ตรงข้ามผู้มีอำนาจไง 

**ยืนยัน ศาล.ไม่ควรรับคำร้องทักษิณล้มล่างการปกครอง ถูกต้องแล้ว

พลิกแฟ้มคดีอ้าง ""อิลลูมินาติ"" ร้องยุบพรรคอนาคตใหม่",0,5,2,0,256,b_B1B2B3,2024-11-22 13:13:01,2024-11-28 23:00:28,อนาคตใหม่
